"requestor_name","organization","description_of_request","date_received","due_date"
"TJ Murphy","None identified","Correspondence","2019-07-18T00:00:00.000","2019-07-25T00:00:00.000"
"Sam Stecklow","South Side Weekly","Records pertaining to Police Board disciplinary cases","2019-06-21T00:00:00.000","2019-06-28T00:00:00.000"
"Gary Annes","Abels & Annes PC","Disciplinary records pertaining to a Chicago police officer.","2019-06-19T00:00:00.000","2019-06-26T00:00:00.000"
"Deborah Thomas","Romanucci & Blandin, LLC","Disciplinary records pertaining to a Chicago police officer.","2019-06-18T00:00:00.000","2019-06-25T00:00:00.000"
"Tim Novak","Chicago Sun-Times","Records pertaining to Police Board disciplinary cases","2019-06-13T00:00:00.000","2019-06-20T00:00:00.000"
"Martin Preib","Fraternal Order of Police","Records pertaining to a Police Board disciplinary case","2019-06-13T00:00:00.000","2019-06-20T00:00:00.000"
"Tim N
TRUNCATED